{
  "event_id": "0d72ff07-a646-4d41-9b5b-52c5f25e4ca8",
  "event_type": "telemetry.recorded",
  "schema_version": 2,
  "occurred_at": "2026-09-21T15:00:00.125000Z",
  "tenant_id": "11111111-1111-4111-8111-111111111111",
  "aggregate_type": "device_telemetry_stream",
  "aggregate_id": "33333333-3333-4333-8333-333333333333",
  "aggregate_version": "42",
  "correlation_id": "4d9d9d30-d209-446e-99ea-d40ab0953d0d",
  "causation_id": "8a2d3d4f-6b73-4fca-9348-4a0a6d3ce7a1",
  "traceparent": "00-4bf92f3577b34da6a3ce929d0e0e4736-00f067aa0ba902b7-01",
  "payload": {
    "reading_id": "bb70cd06-0720-461a-8ecf-a56754985f87",
    "device_id": "33333333-3333-4333-8333-333333333333",
    "site_id": "22222222-2222-4222-8222-222222222222",
    "bin_id": "55555555-5555-4555-8555-555555555555",
    "binding_version": "3",
    "source_message_id": "sensor-003.boot-018.reading-000042",
    "observed_at": "2026-09-21T14:59:59.500000Z",
    "received_at": "2026-09-21T15:00:00.100000Z",
    "measurements": {
      "temperature_c": 28.75,
      "relative_humidity_percent": 66.2,
      "co2_ppm": 450,
      "grain_moisture_percent": 13.5
    },
    "measurement_units": {
      "temperature_c": "Cel",
      "relative_humidity_percent": "%",
      "co2_ppm": "ppm",
      "grain_moisture_percent": "%"
    },
    "sensor_observations": [
      {
        "sensor_id": "77777777-7777-4777-8777-777777777777",
        "metric": "co2_ppm",
        "value": 450,
        "unit": "ppm",
        "layout_version": "2",
        "cable_id": "88888888-8888-4888-8888-888888888888",
        "position": 1,
        "depth_m": 1.5
      },
      {
        "sensor_id": "77777777-7777-4777-8777-777777777777",
        "metric": "co2_ppm",
        "value": 450,
        "unit": "ppm",
        "layout_version": "2",
        "cable_id": "88888888-8888-4888-8888-888888888888",
        "position": 1,
        "depth_m": 1.5
      }
    ]
  }
}
